company,question,answer
cloud99x,What does Cloud99X do?,"Cloud99X is a Sri Lankan digital technology company that helps businesses concept, craft, and launch digital products. We deliver web development, mobile development, software development, technical consultancy, e-commerce solutions, artificial intelligence, blockchain and Web 3.0, cybersecurity, and cloud and IT services."
cloud99x,Can you tell me about Cloud99X?,"Cloud99X delivers innovative digital solutions with a focus on quality and customer satisfaction. Our services include web, mobile, and custom software development, technical consultancy, e-commerce, AI, blockchain and Web 3.0, cybersecurity, and cloud services."
cloud99x,What services does Cloud99X offer?,"Cloud99X offers digital services and solutions including web development, mobile development, software development, technical consultancy, e-commerce solutions, artificial intelligence, blockchain and Web 3.0, cybersecurity solutions, cloud services, and IT consulting."
cloud99x,What kind of services do you provide?,"Our services cover web development, mobile app development, custom software development, technical consultancy, e-commerce solutions, AI solutions, blockchain and Web 3.0 consultancy, cybersecurity, and cloud and IT services."
cloud99x,List all your services,"Cloud99X services include: Web Development; Mobile Development; Software Development; Technical Consultancy; E-Commerce Solutions; Artificial Intelligence; Blockchain and Web 3.0; Cybersecurity Solutions; Cloud Services; and IT Consulting."
cloud99x,What digital solutions do you offer?,"Our digital solutions include E-Commerce Solutions, Artificial Intelligence, Blockchain and Web 3.0, and Cybersecurity Solutions — alongside web, mobile, and software development and technical consultancy."
cloud99x,What digital services do you offer?,"Cloud99X digital services include web development, mobile development, software development, and technical consultancy for developers, startups, and businesses."
cloud99x,What kind of software services do you provide?,"Cloud99X develops custom software tailored to business requirements, including full-stack web, mobile, and scalable custom platforms."
cloud99x,Do you build custom software?,"Yes. Cloud99X develops custom software solutions designed to solve unique business challenges and drive digital transformation."
cloud99x,Can you create software specifically for my business?,"Yes. Solutions are customized based on your business objectives. We help ambitious entrepreneurs and companies concept, craft, and launch digital products."
cloud99x,Do you develop websites?,"Yes. Web development is one of Cloud99X's core digital services — full-stack web solutions built to scale."
cloud99x,Can you build a business website for me?,"Yes. Cloud99X provides web development services for business websites and digital products."
cloud99x,Do you offer web development?,"Yes. Web development is a core Cloud99X service for startups, developers, and businesses."
cloud99x,Do you create mobile apps?,"Yes. Cloud99X provides mobile development services for businesses and startups."
cloud99x,Can you build Android or iPhone apps?,"Yes. Mobile application development is one of our core digital services."
cloud99x,Do you offer mobile development?,"Yes. Cloud99X delivers mobile development as part of our digital services for developers and startups."
cloud99x,Do you provide technical consulting?,"Yes. Technical consultancy is one of Cloud99X's main digital services. We guide projects from concept through launch."
cloud99x,Do you offer technical consultancy?,"Yes. We provide technical consultancy to help businesses plan, build, and scale digital products effectively."
cloud99x,Can I get advice before starting a project?,"Yes. Cloud99X provides technical consultancy and guidance for new projects before and during development."
cloud99x,Do you offer e-commerce solutions?,"Yes. E-Commerce Solutions is one of Cloud99X's featured digital solutions for businesses building online commerce platforms."
cloud99x,Can you build an online store?,"Yes. Cloud99X provides e-commerce solutions as part of our digital solutions portfolio."
cloud99x,Do you provide artificial intelligence services?,"Yes. Artificial Intelligence is one of Cloud99X's digital solutions. We also cover related areas such as data science and NLP through our technology work."
cloud99x,Do you offer AI solutions?,"Yes. Cloud99X offers Artificial Intelligence solutions to help businesses build smarter digital products and workflows."
cloud99x,Do you work with AI and machine learning?,"Yes. Artificial Intelligence is a featured Cloud99X digital solution, and our team also works with data science and NLP-related technology."
cloud99x,Do you offer blockchain and Web 3.0 services?,"Yes. Blockchain and Web 3.0 is one of Cloud99X's digital solutions. We provide consultancy covering blockchain strategy, smart contracts, DeFi and token economy design, and related security and compliance guidance."
cloud99x,Can you help with blockchain consultancy?,"Yes. Cloud99X offers Blockchain and Web 3.0 consultancy including strategy development, smart contract development, and decentralized technology guidance."
cloud99x,Do you provide cybersecurity solutions?,"Yes. Cybersecurity Solutions is one of Cloud99X's core digital offerings. We help organizations strengthen security practices and protect digital assets."
cloud99x,Do you offer cybersecurity services?,"Yes. Cloud99X provides cybersecurity solutions to help businesses protect data, systems, and operations."
cloud99x,Can you help with cybersecurity?,"Yes. Cybersecurity is a featured Cloud99X digital solution covering modern workplace and organizational security needs."
cloud99x,Do you offer cloud services?,"Yes. Cloud99X provides cloud services and IT consulting as part of our technology transformation offerings."
cloud99x,Do you provide IT consulting?,"Yes. IT consulting and cloud services are part of Cloud99X's technology capabilities, supporting scalable digital operations."
cloud99x,Do you offer cloud and IT services?,"Yes. Cloud99X delivers cloud and IT services alongside full-stack web, mobile, and custom software built to scale."
cloud99x,Do you work with startups?,"Yes. Startups are among Cloud99X's key clients. We help ambitious entrepreneurs concept, craft, and launch digital products."
cloud99x,Is Cloud99X suitable for new businesses?,"Yes. New businesses and startups can receive web, mobile, software development, and technical consultancy support from Cloud99X."
cloud99x,Can you help with digital transformation projects?,"Yes. Cloud99X provides digital solutions — including software, e-commerce, AI, blockchain, cybersecurity, and cloud services — to support business transformation."
cloud99x,What technologies do you work with?,"Cloud99X builds modern digital products across web, mobile, software, AI, blockchain and Web 3.0, cybersecurity, and cloud technologies, using contemporary development and delivery practices."
cloud99x,Who is Cloud99X?,"Cloud99X is a Sri Lankan tech company delivering innovative digital solutions. We are the technology and infrastructure partner within the Kanrich Group and work with Connect BPO and Co Spaces as sister companies."
cloud99x,Are you part of Kanrich Group?,"Yes. Cloud99X is part of the Kanrich Group family, alongside Connect BPO, Co Spaces, and other group companies."
cloud99x,How is Cloud99X related to Connect BPO?,"Cloud99X is the technology and infrastructure partner for Connect BPO within the Kanrich Group, supporting secure infrastructure, monitoring, cybersecurity, and software delivery."
cloud99x,What is your mission?,"Our mission is to create groundbreaking digital solutions that empower businesses to excel — balancing great design, efficient technology, and disruptive brands to make the digital age more human-friendly."
cloud99x,What is your vision?,"Cloud99X aims to be a leading digital innovation partner, empowering businesses with creative and transformative solutions that turn ideas into impactful realities."
cloud99x,How do I start a project with Cloud99X?,"Contact Cloud99X through the website contact form, email hello@cloud99x.com, or call 076 855 1032 to discuss your project requirements."
cloud99x,How can I get in touch with Cloud99X?,"You can email hello@cloud99x.com, call 076 855 1032, or use the contact form on https://www.cloud99x.com/contact. We are available Monday to Sunday, 24x7."
cloud99x,What is your email address?,You can reach Cloud99X at hello@cloud99x.com.
cloud99x,What is your phone number?,You can call Cloud99X at 076 855 1032.
cloud99x,Where is Cloud99X based?,"Cloud99X is a Sri Lankan technology company. Contact us via hello@cloud99x.com or 076 855 1032 for project discussions."
cloud99x,Can Cloud99X provide a customized solution?,"Yes. Every engagement is tailored to your unique needs — from web and mobile products to AI, e-commerce, blockchain, cybersecurity, and cloud solutions."
cloud99x,Do you have a portfolio or past work?,"Yes. Cloud99X showcases digital product work on our website portfolio. Visit https://www.cloud99x.com/ to explore our work and services."
cloud99x,Do you write blogs or share tech insights?,"Yes. Cloud99X publishes blogs on topics such as cybersecurity, NLP and data science, and blockchain and Web 3.0 consultancy on our website."
cloud99x,Hi,Hello! Welcome to Cloud99X. How can I help you today?
cloud99x,Hello,Hi there! Welcome to Cloud99X.
cloud99x,Hey,Hey! Welcome to Cloud99X. What can I do for you?
cloud99x,Hey there,Hello! How can I assist you today?
cloud99x,Good morning,Good morning! Welcome to Cloud99X.
cloud99x,Good afternoon,Good afternoon! How can I help?
cloud99x,Good evening,Good evening! Welcome to Cloud99X.
cloud99x,What's up?,Hi! I'm here to answer your questions about Cloud99X.
cloud99x,How are you?,I'm doing great! Thanks for asking. How can I help?
cloud99x,How's it going?,Everything's going well! What would you like to know?
cloud99x,Nice to meet you,Nice to meet you too!
cloud99x,Can you help me?,"Absolutely! Ask me about web development, mobile apps, software, AI, e-commerce, blockchain, cybersecurity, cloud services, or how to start a project."
cloud99x,I need help,Sure! What would you like help with?
cloud99x,Who are you?,"I'm the Cloud99X virtual assistant. I can answer questions about our software development, digital solutions, and technology services."
cloud99x,What can you do?,"I can answer questions about Cloud99X services including web development, mobile development, software development, technical consultancy, e-commerce, AI, blockchain and Web 3.0, cybersecurity, and cloud and IT services."
cloud99x,What do you do?,I help visitors learn more about Cloud99X and our services.
cloud99x,Thank you,You're welcome! Feel free to ask if you have more questions.
cloud99x,Thanks,Happy to help!
cloud99x,Bye,Goodbye! Thanks for visiting Cloud99X.
cloud99x,Goodbye,Have a great day! Feel free to visit again.
cloud99x,See you later,See you soon!
cloud99x,I don't know what to ask,"You can ask about web development, mobile apps, software development, AI, e-commerce, blockchain, cybersecurity, cloud services, technical consultancy, or how to start a project."
cloud99x,Can I ask you something?,Of course! Go ahead.
cloud99x,Are you a real person?,I'm an AI virtual assistant designed to help answer questions about Cloud99X.
cloud99x,Are you a chatbot?,Yes! I'm Cloud99X's virtual assistant.
