company,question,answer
cloud99x,What does Cloud99X do?,"Cloud99X provides software development, technical consulting, and digital solutions for businesses and startups."
cloud99x,Can you tell me about Cloud99X?,Cloud99X helps businesses build software products and digital solutions.
cloud99x,What services does Cloud99X offer?,"Services include software development, web development, mobile app development, UI/UX design, consulting, branding, and digital solutions."
cloud99x,What kind of software services do you provide?,Cloud99X develops custom software tailored to business requirements.
cloud99x,Do you build custom software?,"Yes, Cloud99X develops custom software solutions."
cloud99x,Can you create software specifically for my business?,"Yes, solutions are customized based on client needs."
cloud99x,Do you develop websites?,"Yes, Cloud99X provides web development services."
cloud99x,Can you build a business website for me?,"Yes, website development is one of the core services offered."
cloud99x,Do you create mobile apps?,"Yes, Cloud99X develops mobile applications for businesses and startups."
cloud99x,Can you build Android or iPhone apps?,"Yes, mobile application development services are available."
cloud99x,Do you offer UI and UX design?,"Yes, UI/UX design services are provided to improve user experience."
cloud99x,Can you help improve the design of my product?,"Yes, Cloud99X offers UI/UX design and user experience optimization."
cloud99x,Do you provide technical consulting?,"Yes, technical consulting is one of the main services offered."
cloud99x,Can I get advice before starting a project?,"Yes, Cloud99X provides consultation and guidance for new projects."
cloud99x,Do you work with startups?,"Yes, startups are among the key clients served by Cloud99X."
cloud99x,Is Cloud99X suitable for new businesses?,"Yes, new businesses can receive technical and product development support."
cloud99x,Can you help with digital transformation projects?,"Yes, Cloud99X provides digital solutions and technical expertise for business transformation."
cloud99x,How do I start a project with Cloud99X?,Contact the team through the website to discuss your project requirements.
cloud99x,How can I get in touch with Cloud99X?,You can contact Cloud99X using the contact information available on the website.
cloud99x,Can Cloud99X provide a customized solution?,"Yes, solutions are tailored according to business objectives and requirements."
