company,question,answer
cospaces,What is CoSpaces?,"CoSpaces is a coworking and flexible workspace provider designed for freelancers, startups, remote workers, and businesses."
cospaces,Can you tell me about CoSpaces?,"CoSpaces offers flexible workspaces, meeting rooms, and private offices for professionals and teams."
cospaces,What does CoSpaces offer?,"CoSpaces provides coworking spaces, desks, meeting rooms, and private office solutions."
cospaces,Where is CoSpaces located?,"CoSpaces is located in Colombo 04, Sri Lanka."
cospaces,What is your location?,"CoSpaces operates from Colombo 04, providing convenient workspace facilities."
cospaces,How do I find your office?,You can find CoSpaces in Colombo 04 and contact the team for directions.
cospaces,What types of workspaces are available?,"CoSpaces offers hot desks, dedicated desks, meeting rooms, pods, and private offices."
cospaces,Do you have private offices?,"Yes, private office spaces are available for individuals and teams."
cospaces,Can I rent a dedicated desk?,"Yes, dedicated desk options are available."
cospaces,What is a hot desk?,A hot desk is a flexible seating option where you can use any available desk.
cospaces,Can I book a meeting room?,"Yes, meeting rooms can be booked based on availability."
cospaces,Do you offer meeting spaces?,"Yes, CoSpaces provides meeting rooms for professional discussions and team meetings."
cospaces,Can I book a room just for a few hours?,"Yes, meeting rooms can be reserved for short-term use."
cospaces,Who is CoSpaces best suited for?,"CoSpaces is ideal for freelancers, entrepreneurs, startups, SMEs, and remote workers."
cospaces,Is CoSpaces good for startups?,"Yes, startups can benefit from flexible workspace solutions."
cospaces,Can remote workers use CoSpaces?,"Yes, remote workers can use coworking facilities and meeting spaces."
cospaces,Do you provide workspace for teams?,"Yes, private offices and dedicated spaces are available for teams."
cospaces,How can I contact CoSpaces?,"You can contact CoSpaces through the website, phone, or email."
cospaces,Can I arrange a visit before joining?,"Yes, you can contact the team to arrange a tour or visit."
cospaces,How do I get started with CoSpaces?,Contact the team to discuss workspace availability and membership options.
cospaces,Hi,Hello! Welcome to CoSpaces. How can I help you today?
cospaces,Hello,Hi there! Welcome to CoSpaces.
cospaces,Hey,Hey! Welcome to CoSpaces.
cospaces,Hey there,Hello! What can I help you with today?
cospaces,Good morning,Good morning! Welcome to CoSpaces.
cospaces,Good afternoon,Good afternoon! How may I assist you?
cospaces,Good evening,Good evening! Welcome to CoSpaces.
cospaces,What's up?,Hi! I'm here to answer your questions about CoSpaces.
cospaces,How are you?,I'm doing great! Thanks for asking. How can I help?
cospaces,How's it going?,I'm doing well! What would you like to know about CoSpaces?
cospaces,Nice to meet you,Nice to meet you too!
cospaces,Can you help me?,Absolutely! Ask me anything about CoSpaces.
cospaces,I need help,I'd be happy to help. What would you like to know?
cospaces,Who are you?,I'm the CoSpaces virtual assistant. I can answer questions about our coworking spaces and facilities.
cospaces,What can you do?,"I can answer questions about coworking spaces, meeting rooms, private offices, memberships, and our location."
cospaces,What do you do?,I help visitors find information about CoSpaces.
cospaces,Thank you,You're very welcome! Let me know if you need anything else.
cospaces,Thanks,Happy to help!
cospaces,Bye,Goodbye! Thanks for visiting CoSpaces.
cospaces,Goodbye,Have a wonderful day!
cospaces,See you later,See you again soon!
cospaces,I don't know what to ask,"You can ask me about our coworking spaces, meeting rooms, memberships, location, or facilities."
cospaces,Can I ask you something?,Of course! Go ahead and ask your question.
cospaces,Are you a real person?,I'm an AI virtual assistant created to help answer questions about CoSpaces.
cospaces,Are you a chatbot?,Yes! I'm the CoSpaces virtual assistant.
